{
  "$schema": "https://mintlify.com/docs.json",
  "theme": "mint",

  "name": "ELITEA Documentation",
  "logo": {
    "light": "/img/elitea-logo-light.svg",
    "dark": "/img/elitea-logo-dark.svg",
    "href": "https://elitea.ai"
  },
  "favicon": "/img/favicon.ico",

  "colors": {
    "primary": "#C428DD",
    "light": "#6AE8FA",
    "dark": "#A020D0"
  },

  "background": {
    "color": {
      "light": "#FDFDFD",
      "dark": "#0E131D"
    }
  },

  "appearance": {
    "default": "system"
  },

  "fonts": {
    "family": "Inter"
  },

  "css": ["/custom.css"],

  "navbar": {
    "links": [
      {
        "label": "API Documentation",
        "href": "https://next.elitea.ai/shared/swagger/"
      }
    ],
    "primary": {
      "type": "button",
      "label": "ELITEA Platform",
      "href": "https://next.elitea.ai"
    }
  },

  "styling": {
    "eyebrows": "breadcrumbs"
  },

  "navigation": {
    "tabs": [
      {
        "tab": "Home",
        "icon": "house",
        "groups": [
          {
            "group": "Welcome to ELITEA",
            "pages": ["index", "home/introduction", "home/onboarding-tips"]
          },
          {
            "group": "Key Concepts",
            "icon": "lightbulb",
            "pages": [
              "home/key-concepts/what-is-an-agent",
              "home/key-concepts/what-is-a-skill",
              "home/key-concepts/what-is-a-pipeline",
              "home/key-concepts/what-is-a-credential",
              "home/key-concepts/what-is-a-toolkit",
              "home/key-concepts/what-is-a-conversation",
              "home/key-concepts/what-is-an-artifact",
              "home/key-concepts/what-is-a-canvas"
            ]
          },
          {
            "group": "Reference",
            "icon": "book",
            "pages": ["home/glossary"]
          },
          {
            "group": "Platform Overview",
            "icon": "compass",
            "pages": [
              "menus/overview",
              {
                "group": "Menus",
                "icon": "compass",
                "expanded": false,
                "pages": [
                  "menus/chat",
                  "menus/agents",
                  "menus/skills",
                  "menus/pipelines",
                  "menus/credentials",
                  "menus/toolkits",
                  "menus/applications",
                  "menus/mcps",
                  "menus/artifacts",
                  "menus/agents-studio"
                ]
              },
              {
                "group": "Settings",
                "icon": "gear",
                "expanded": false,
                "pages": [
                  "menus/settings/settings-overview",
                  {
                    "group": "Project Settings",
                    "pages": [
                      "menus/settings/general",
                      "menus/settings/ai-providers",
                      "menus/settings/project-context",
                      "menus/settings/secrets",
                      "menus/settings/users",
                      "menus/settings/analytics",
                      "menus/settings/usage"
                    ]
                  },
                  {
                    "group": "Personal Settings",
                    "pages": [
                      "menus/settings/user-profile",
                      "menus/settings/preferences",
                      "menus/settings/ai-personality",
                      "menus/settings/memory",
                      "menus/settings/personal-tokens",
                      "menus/settings/notifications"
                    ]
                  }
                ]
              },
              "menus/resources",
              "menus/support-assistant"
            ]
          }
        ]
      },
      {
        "tab": "Getting Started",
        "icon": "rocket",
        "groups": [
          {
            "group": "Quick Start",
            "icon": "bolt",
            "pages": ["getting-started/chat-quick-start", "getting-started/connect-toolkits-quick-start"]
          },
          {
            "group": "Setup & Configuration",
            "icon": "gear",
            "pages": [
              "getting-started/configure-epam-ai-dial-key",
              "getting-started/create-personal-access-token",
              "getting-started/create-secret",
              "getting-started/create-credential",
              "getting-started/create-artifact"
            ]
          },
          {
            "group": "System Health",
            "icon": "stethoscope",
            "pages": ["getting-started/system-health-checklist"]
          }
        ]
      },
      {
        "tab": "How-To Guides",
        "icon": "book-open",
        "groups": [
          {
            "group": "Chats",
            "icon": "comments",
            "pages": [
              {
                "group": "Chat Basics",
                "expanded": true,
                "pages": [
                  "how-tos/chat/config-mnmt",
                  "how-tos/chat/participants",
                  "how-tos/chat/attachments",
                  "how-tos/chat/responses",
                  "how-tos/chat/ctxt-bdgt",
                  "how-tos/chat/voice",
                  "how-tos/chat/action-auth"
                ]
              },
              {
                "group": "Canvas",
                "expanded": false,
                "pages": [
                  "how-tos/chat-conversations/how-to-canvas",
                  "how-tos/chat-conversations/file-editing-canvas",
                  "how-tos/chat-conversations/how-to-create-and-edit-agents-from-canvas",
                  "how-tos/chat-conversations/how-to-create-and-edit-pipelines-from-canvas",
                  "how-tos/chat-conversations/how-to-create-and-edit-toolkits-from-canvas",
                  "how-tos/chat-conversations/how-to-create-and-edit-mcps-from-canvas"
                ]
              },
              {
                "group": "Modules",
                "expanded": false,
                "pages": [
                  "how-tos/modules/modules",
                  "how-tos/chat-conversations/image-generation",
                  "how-tos/modules/web-search",
                  "how-tos/chat-conversations/data-analysis-internal-tool",
                  "how-tos/chat-conversations/agents-&-pipeline-builder",
                  "how-tos/modules/skill-builder",
                  "how-tos/modules/project-context-builder",
                  "how-tos/modules/ask-user",
                  "how-tos/chat-conversations/planner-internal-tool",
                  "how-tos/chat-conversations/python-sandbox-internal-tool",
                  "how-tos/chat-conversations/swarm-mode-internal-tool",
                  "how-tos/chat-conversations/smart-tools-selection-internal-tool"
                ]
              }
            ]
          },
          {
            "group": "Indexing",
            "icon": "database",
            "pages": [
              {
                "group": "Start with Indexing",
                "expanded": true,
                "pages": [
                  "how-tos/indexing/indexing-overview",
                  "how-tos/indexing/using-indexes-tab-interface",
                  "how-tos/indexing/indexing-tools"
                ]
              },
              {
                "group": "Manage Indexes",
                "expanded": false,
                "pages": ["how-tos/indexing/schedule-indexing", "how-tos/indexing/vector_search"]
              },
              {
                "group": "Index Specific Sources",
                "expanded": false,
                "pages": [
                  {
                    "group": "Documentation & Content",
                    "expanded": false,
                    "pages": [
                      "how-tos/indexing/index-confluence-data",
                      "how-tos/indexing/index-sharepoint-data",
                      "how-tos/indexing/index-ado-wiki-data",
                      "how-tos/indexing/index-figma-data",
                      "how-tos/indexing/index-artifacts-data"
                    ]
                  },
                  {
                    "group": "Development & Project Data",
                    "expanded": false,
                    "pages": ["how-tos/indexing/index-github-data", "how-tos/indexing/index-jira-data"]
                  },
                  {
                    "group": "Test Management",
                    "expanded": false,
                    "pages": [
                      "how-tos/indexing/index-testrail-data",
                      "how-tos/indexing/index-xray-data",
                      "how-tos/indexing/index-zephyr-data"
                    ]
                  }
                ]
              }
            ]
          },
          {
            "group": "Agents, Pipelines & Skills",
            "icon": "robot",
            "pages": [
              {
                "group": "Manage Agents, Pipelines & Skills",
                "expanded": true,
                "pages": [
                  "how-tos/agents-pipelines/build-agent-with-ai",
                  "how-tos/agents-pipelines/agents-pipelines-history",
                  "how-tos/agents-pipelines/entity-versioning",
                  "how-tos/agents-pipelines/import-export",
                  "how-tos/agents-pipelines/forking",
                  "how-tos/agents-pipelines/agent-publishing",
                  "how-tos/agents-pipelines/skill-publishing"
                ]
              },
              {
                "group": "Agent Evaluation",
                "expanded": false,
                "pages": ["how-tos/agents-pipelines/agent-evaluation", "how-tos/agents-pipelines/agent-evaluation-faq"]
              },
              {
                "group": "Start Building Pipelines",
                "expanded": false,
                "pages": [
                  "how-tos/pipelines/overview",